<!-- 11 June 2012 --><!-- For Conceptual Model Calendar Data Vs 1.7, 21 May 2013 --><xs:schema xmlns:xs="http://www.w3.org/2001/XMLSchema" elementFormDefault="qualified" attributeFormDefault="unqualified"><xs:element name="calendarX" type="CalendarX"><xs:annotation><xs:documentation> Uniqueness constraints relate to the description attribute. (1) There
                is only one CalendarX element in the system, so its description attribute is
                automatically unique for CalendarX objects. (2) Event objects are not identified
                through their description attribute. The description attribute of Event objects
                takes its value from the description attribute of the indirectly related SuperEvent
                object. (3) Objects of other types that have a description attribute are uniquely
                identified by their description attribute. For example, all objects of type User
                need to be identified by their descriptions, but description values of User objects
                and of Pattern objects may be identical.</xs:documentation><xs:documentation>The following elements refer to description attributes of other
                elements: owner, location, attendee, definedBy, recurrencePattern, firstPattern, furtherPattern.
                Referential integrity is guaranteed by xs:keyRef constraints.</xs:documentation></xs:annotation><xs:key name="UserKey"><xs:selector xpath=".//users/user"/><xs:field xpath="@description"/></xs:key><xs:key name="CalendarKey"><xs:selector xpath=".//calendars/calendar"/><xs:field xpath="@description"/></xs:key><xs:key name="SuperEventKey"><xs:selector xpath=".//superEvents/superEvent"/><xs:field xpath="@description"/></xs:key><xs:key name="EventRuleKey"><xs:selector xpath=".//eventRules/eventRule"/><xs:field xpath="@description"/></xs:key><xs:key name="PatternKey"><xs:annotation><xs:documentation>XPath 1.0 is not compatible with substitution groups. Hence we use
                    * rather than the more specific "anything in the head group of
                    pattern".</xs:documentation></xs:annotation><xs:selector xpath=".//patterns/*"/><xs:field xpath="@description"/></xs:key><xs:key name="LocationKey"><xs:selector xpath=".//locations/location"/><xs:field xpath="@description"/></xs:key><xs:key name="ContactKey"><xs:selector xpath=".//contacts/contact"/><xs:field xpath="@description"/></xs:key>
        <!-- 
        owner, location, attendee, definedBy, recurrencePattern, firstPattern, furtherPattern
        --><xs:keyref refer="UserKey" name="Calendar2Owner"><xs:selector xpath=".//calendar/owner"/><xs:field xpath="."/></xs:keyref><xs:keyref refer="LocationKey" name="EventRule2Location"><xs:selector xpath=".//eventRule/location"/><xs:field xpath="."/></xs:keyref><xs:keyref refer="ContactKey" name="EventRule2Contact"><xs:selector xpath=".//eventRule/attendees/attendee"/><xs:field xpath="."/></xs:keyref><xs:keyref refer="EventRuleKey" name="Event2EventRule"><xs:selector xpath=".//event/definedBy"/><xs:field xpath="."/></xs:keyref><xs:keyref refer="EventRuleKey" name="Event2Location"><xs:selector xpath=".//event/location"/><xs:field xpath="."/></xs:keyref><xs:keyref refer="EventRuleKey" name="Event2Contact"><xs:selector xpath=".//event/attendees/attendee"/><xs:field xpath="."/></xs:keyref><xs:keyref refer="PatternKey" name="EventRule2Pattern"><xs:selector xpath=".//eventRule/recurrencePattern"/><xs:field xpath="."/></xs:keyref><xs:keyref refer="PatternKey" name="ComplexPattern2PatternFirst"><xs:selector xpath=".//firstPattern"/><xs:field xpath="."/></xs:keyref><xs:keyref refer="PatternKey" name="ComplexPattern2PatternFurther"><xs:selector xpath=".//furtherPattern"/><xs:field xpath="."/></xs:keyref></xs:element><xs:complexType name="CalendarX"><xs:all><xs:element name="users"><xs:complexType><xs:sequence><xs:element name="user" type="User" minOccurs="0" maxOccurs="unbounded"/></xs:sequence></xs:complexType></xs:element><xs:element name="calendars"><xs:complexType><xs:sequence><xs:element name="calendar" type="Calendar" minOccurs="0" maxOccurs="unbounded"/></xs:sequence></xs:complexType></xs:element><xs:element name="patterns"><xs:complexType><xs:sequence><xs:element ref="pattern" minOccurs="0" maxOccurs="unbounded"/></xs:sequence></xs:complexType></xs:element><xs:element name="contacts"><xs:complexType><xs:sequence><xs:element name="contact" type="Contact" minOccurs="0" maxOccurs="unbounded"/></xs:sequence></xs:complexType></xs:element><xs:element name="locations"><xs:complexType><xs:sequence><xs:element name="location" type="Location" minOccurs="0" maxOccurs="unbounded"/></xs:sequence></xs:complexType></xs:element></xs:all><xs:attribute name="description" type="xs:string" use="required"/></xs:complexType><xs:complexType name="Calendar"><xs:all><xs:element name="owner" type="xs:string" minOccurs="0" maxOccurs="1"/><xs:element name="superEvents"><xs:complexType><xs:sequence><xs:element name="superEvent" type="SuperEvent" minOccurs="0" maxOccurs="unbounded"/></xs:sequence></xs:complexType></xs:element></xs:all><xs:attribute name="description" type="xs:string" use="required"/></xs:complexType><xs:complexType name="User"><xs:attribute name="description" type="xs:string" use="required"/></xs:complexType><xs:complexType name="SuperEvent"><xs:all><xs:element name="eventRules"><xs:complexType><xs:sequence><xs:element name="eventRule" type="EventRule" minOccurs="0" maxOccurs="unbounded"/></xs:sequence></xs:complexType></xs:element></xs:all><xs:attribute name="description" type="xs:string" use="required"/><xs:attribute name="categories" type="Categories" use="required"/></xs:complexType><xs:complexType name="EventRule"><xs:all><xs:element name="recurrencePattern" type="xs:string"/><xs:element name="location" type="xs:string" minOccurs="0" maxOccurs="1"/><xs:element name="attendees"><xs:complexType><xs:sequence><xs:element name="attendee" type="xs:string" minOccurs="0" maxOccurs="unbounded"/></xs:sequence></xs:complexType></xs:element></xs:all><xs:attribute name="description" type="xs:string" use="required"/><xs:attribute name="startTime" type="xs:time" use="required"/><xs:attribute name="endTime" type="xs:time" use="required"/><xs:attribute name="note" type="xs:string" use="required"/></xs:complexType><xs:complexType name="Event"><xs:all><xs:element name="definedBy" type="xs:string" minOccurs="0" maxOccurs="1"/><xs:element name="location" type="xs:string" minOccurs="0" maxOccurs="1"/><xs:element name="attendees"><xs:complexType><xs:sequence><xs:element name="attendee" type="xs:string" minOccurs="0" maxOccurs="unbounded"/></xs:sequence></xs:complexType></xs:element></xs:all><xs:attribute name="description" type="xs:string" use="required"/><xs:attribute name="categories" type="Categories" use="required"/><xs:attribute name="date" type="xs:date" use="required"/><xs:attribute name="startTime" type="xs:time" use="required"/><xs:attribute name="endTime" type="xs:time" use="required"/><xs:attribute name="note" type="xs:string" use="required"/></xs:complexType><xs:complexType name="Pattern" abstract="true"><xs:attribute name="description" type="xs:string" use="required"/></xs:complexType><xs:element name="pattern" type="Pattern" abstract="true"/><xs:complexType name="ComplexPattern" abstract="true"><xs:complexContent><xs:extension base="Pattern"><xs:sequence><xs:element name="firstPattern" type="xs:string"/><xs:element name="furtherPatterns"><xs:complexType><xs:sequence><xs:element name="furtherPattern" type="xs:string" minOccurs="0" maxOccurs="unbounded"/></xs:sequence></xs:complexType></xs:element></xs:sequence></xs:extension></xs:complexContent></xs:complexType><xs:element name="complexPattern" type="ComplexPattern" abstract="true" substitutionGroup="pattern"/><xs:complexType name="UnionPattern"><xs:complexContent><xs:extension base="ComplexPattern"/></xs:complexContent></xs:complexType><xs:element name="unionPattern" type="UnionPattern" substitutionGroup="complexPattern"/><xs:complexType name="IntersectionPattern"><xs:complexContent><xs:extension base="ComplexPattern"/></xs:complexContent></xs:complexType><xs:element name="intersectionPattern" type="IntersectionPattern" substitutionGroup="complexPattern"/><xs:complexType name="DifferencePattern"><xs:complexContent><xs:extension base="ComplexPattern"/></xs:complexContent></xs:complexType><xs:element name="differencePattern" type="DifferencePattern" substitutionGroup="complexPattern"/><xs:complexType name="SimplePattern" abstract="true"><xs:complexContent><xs:extension base="Pattern"><xs:attribute name="startDate" type="xs:date" use="optional"/><xs:attribute name="endDate" type="xs:date" use="optional"/><xs:attribute name="frequency" type="xs:nonNegativeInteger" default="1" use="optional"><xs:annotation><xs:documentation>There will always be a value for this attribute, although
                            it is declared as optional, because of the default
                            value.</xs:documentation></xs:annotation></xs:attribute></xs:extension></xs:complexContent></xs:complexType><xs:element name="simplePattern" type="SimplePattern" abstract="true" substitutionGroup="pattern"/><xs:complexType name="DailyPattern"><xs:complexContent><xs:extension base="SimplePattern"/></xs:complexContent></xs:complexType><xs:element name="dailyPattern" type="DailyPattern" substitutionGroup="simplePattern"/><xs:complexType name="WeeklyPattern"><xs:complexContent><xs:extension base="SimplePattern"><xs:attribute name="dayOfWeek" type="DayOfWeek" use="required"/></xs:extension></xs:complexContent></xs:complexType><xs:element name="weeklyPattern" type="WeeklyPattern" substitutionGroup="simplePattern"/><xs:complexType name="MonthlyPattern" abstract="true"><xs:complexContent><xs:extension base="SimplePattern"/></xs:complexContent></xs:complexType><xs:element name="monthlyPattern" type="MonthlyPattern" substitutionGroup="simplePattern"/><xs:complexType name="CardinalMonthlyPattern"><xs:complexContent><xs:extension base="MonthlyPattern"><xs:attribute name="dayOfMonth" type="DayOfMonth" use="required"/></xs:extension></xs:complexContent></xs:complexType><xs:element name="cardinalMonthlyPattern" type="CardinalMonthlyPattern" substitutionGroup="monthlyPattern"/><xs:complexType name="OrdinalMonthlyPattern"><xs:complexContent><xs:extension base="MonthlyPattern"><xs:attribute name="ordinal" type="Ordinal" use="required"/><xs:attribute name="dayType" type="DayType" use="required"/></xs:extension></xs:complexContent></xs:complexType><xs:element name="ordinalMonthlyPattern" type="OrdinalMonthlyPattern" substitutionGroup="monthlyPattern"/><xs:complexType name="YearlyPattern" abstract="true"><xs:complexContent><xs:extension base="SimplePattern"><xs:attribute name="month" type="Month" use="required"/></xs:extension></xs:complexContent></xs:complexType><xs:element name="yearlyPattern" type="YearlyPattern" substitutionGroup="simplePattern"/><xs:complexType name="CardinalYearlyPattern"><xs:complexContent><xs:extension base="YearlyPattern"><xs:attribute name="dayOfMonth" type="DayOfMonth" use="required"/></xs:extension></xs:complexContent></xs:complexType><xs:element name="cardinalYearlyPattern" type="CardinalYearlyPattern" substitutionGroup="yearlyPattern"/><xs:complexType name="OrdinalYearlyPattern"><xs:complexContent><xs:extension base="YearlyPattern"><xs:attribute name="ordinal" type="Ordinal" use="required"/><xs:attribute name="dayType" type="DayType" use="required"/></xs:extension></xs:complexContent></xs:complexType><xs:element name="ordinalYearlyPattern" type="OrdinalYearlyPattern" substitutionGroup="yearlyPattern"/><xs:complexType name="Location"><xs:attribute name="description" type="xs:string" use="required"/></xs:complexType><xs:complexType name="Contact"><xs:attribute name="description" type="xs:string" use="required"/></xs:complexType><xs:simpleType name="Categories"><xs:list itemType="xs:Name"/></xs:simpleType><xs:simpleType name="DayType"><xs:restriction base="xs:string"><xs:enumeration value="day"/><xs:enumeration value="weekDay"/></xs:restriction></xs:simpleType><xs:simpleType name="Ordinal"><xs:restriction base="xs:string"><xs:enumeration value="first"/><xs:enumeration value="second"/><xs:enumeration value="third"/><xs:enumeration value="fourth"/><xs:enumeration value="penultimate"/><xs:enumeration value="ultimate"/></xs:restriction></xs:simpleType><xs:simpleType name="DayOfWeek"><xs:restriction base="xs:string"><xs:enumeration value="Monday"/><xs:enumeration value="Tuesday"/><xs:enumeration value="Wednesday"/><xs:enumeration value="Thursday"/><xs:enumeration value="Friday"/><xs:enumeration value="Saturday"/><xs:enumeration value="Sunday"/></xs:restriction></xs:simpleType><xs:simpleType name="Month"><xs:restriction base="xs:string"><xs:enumeration value="January"/><xs:enumeration value="February"/><xs:enumeration value="March"/><xs:enumeration value="April"/><xs:enumeration value="May"/><xs:enumeration value="June"/><xs:enumeration value="July"/><xs:enumeration value="August"/><xs:enumeration value="September"/><xs:enumeration value="October"/><xs:enumeration value="November"/><xs:enumeration value="December"/></xs:restriction></xs:simpleType><xs:simpleType name="DayOfMonth"><xs:restriction base="xs:nonNegativeInteger"><xs:minInclusive value="1"/><xs:maxInclusive value="31"/></xs:restriction></xs:simpleType></xs:schema>