<calendarX xmlns:xsi="http://www.w3.org/2001/XMLSchema-instance" xsi:noNamespaceSchemaLocation="../schemas/CalendarX.xsd" description="Demonstrating super events"><calendars><calendar description="Demonstrating super events"><superEvents><superEvent description="XMLT20155" categories="teaching"><eventRules><eventRule description="XMLT20155_1" startTime="10:20:00" endTime="12:15:00" note=""><recurrencePattern>XMLT20155_1</recurrencePattern><attendees/></eventRule></eventRules></superEvent><superEvent description="EPS20155" categories="teaching"><eventRules><eventRule description="EPS20155_1" startTime="18:15:00" endTime="20:45:00" note=""><recurrencePattern>EPS20155_1</recurrencePattern><attendees><attendee>Anne BrÃ¼ggemann-Klein</attendee><attendee>David Becher</attendee></attendees></eventRule></eventRules></superEvent><superEvent description="bbbb" categories="teaching"><eventRules><eventRule description="bbbb_1" startTime="12:15:00" endTime="13:45:00" note=""><recurrencePattern>bbbb_1</recurrencePattern><attendees><attendee>Test</attendee><attendee>John</attendee><attendee>Yiannis</attendee></attendees></eventRule></eventRules></superEvent><superEvent description="Test" categories="teaching"><eventRules><eventRule description="Test" startTime="10:00:00" endTime="12:00:00" note=""><recurrencePattern>
                                Test
                            </recurrencePattern><attendees><attendee>Test</attendee></attendees><location>
                                Test
                            </location></eventRule></eventRules></superEvent><superEvent description="Test_2" categories="Test_2"><eventRules><eventRule description="Test_2" startTime="10:00:00" endTime="12:00:00" note="Test"><recurrencePattern>Test_2</recurrencePattern><attendees><attendee>Tet</attendee></attendees><location>Test</location></eventRule></eventRules></superEvent><superEvent description="Tes21" categories="Test21"><eventRules><eventRule description="Tes21_1" startTime="10:00:00" endTime="12:00:00" note="Test"><recurrencePattern>Tes21_1</recurrencePattern><attendees><attendee>Test</attendee><attendee> test123</attendee></attendees><location>Test</location></eventRule></eventRules></superEvent><superEvent description="Test1223123" categories="test12312"><eventRules><eventRule description="Test1223123" startTime="10:00:00" endTime="12:00:00" note="Test"><recurrencePattern>Test1223123</recurrencePattern><attendees><attendee>Test</attendee></attendees><location>Test</location></eventRule></eventRules></superEvent><superEvent description="TEas12" categories="pd"><eventRules><eventRule description="TEas12" startTime="10:00:00" endTime="12:00:00" note="Testa"><recurrencePattern>TEas12</recurrencePattern><attendees><attendee>Tas</attendee></attendees><location>Teas</location></eventRule></eventRules></superEvent><superEvent description="Testat400" categories="dd"><eventRules><eventRule description="Testat400" startTime="10:00:00" endTime="12:00:00" note="tes"><recurrencePattern>Testat400</recurrencePattern><attendees><attendee>tes</attendee></attendees><location>tes</location></eventRule></eventRules></superEvent><superEvent description="Teasa" categories="Tes"><eventRules><eventRule description="Teasa" startTime="23:00:00" endTime="23:30:00" note="Teas"><recurrencePattern>Teasa</recurrencePattern><attendees><attendee>Tes</attendee></attendees><location>DD</location></eventRule></eventRules></superEvent><superEvent description="TesYear1" categories="test"><eventRules><eventRule description="TesYear1_1" startTime="10:00:00" endTime="12:00:00" note="Test"><recurrencePattern>TesYear1_1</recurrencePattern><attendees><attendee>Test</attendee></attendees><location>Test</location></eventRule></eventRules></superEvent><superEvent description="TestMonthOrd" categories="Test"><eventRules><eventRule description="TestMonthOrd_1" startTime="10:00:00" endTime="12:00:00" note="TT"><recurrencePattern>TestMonthOrd_1</recurrencePattern><attendees><attendee>TT</attendee></attendees><location>TT</location></eventRule></eventRules></superEvent><superEvent description="TestEndDateDisability" categories="test"><eventRules><eventRule description="TestEndDateDisability" startTime="10:00:00" endTime="12:00:00" note="test"><recurrencePattern>TestEndDateDisability</recurrencePattern><attendees><attendee>test2</attendee></attendees><location>test2</location></eventRule></eventRules></superEvent><superEvent description="TestLast" categories="test"><eventRules><eventRule description="TestLast" startTime="12:00:00" endTime="14:00:00" note="Test"><recurrencePattern>TestLast</recurrencePattern><attendees><attendee>Test</attendee></attendees><location>Test</location></eventRule></eventRules></superEvent></superEvents></calendar></calendars><patterns><differencePattern description="XMLT2015_d_1"><firstPattern>XMLT20155_1</firstPattern><furtherPatterns><furtherPattern>Feiertage2015</furtherPattern></furtherPatterns></differencePattern><intersectionPattern description="XMLT20155_1"><firstPattern>XMLT20155</firstPattern><furtherPatterns><furtherPattern>thursday</furtherPattern></furtherPatterns></intersectionPattern><unionPattern description="Feiertage2015"><firstPattern>ChrHf</firstPattern><furtherPatterns><furtherPattern>Fronleichnam</furtherPattern></furtherPatterns></unionPattern><unionPattern description="bbbb_1"><firstPattern>monday</firstPattern><furtherPatterns/></unionPattern><intersectionPattern description="EPS20155_1"><firstPattern>EPS20155</firstPattern><furtherPatterns><furtherPattern>tuesday</furtherPattern><furtherPattern>thursday</furtherPattern></furtherPatterns></intersectionPattern><dailyPattern description="ChrHf" startDate="2015-05-14" endDate="2015-05-14"/><dailyPattern description="Fronleichnam" startDate="2015-06-04" endDate="2015-06-04"/><dailyPattern description="XMLT20155" startDate="2015-04-13" endDate="2015-07-17"/><dailyPattern description="EPS20155" startDate="2015-04-13" endDate="2015-07-17"/><weeklyPattern description="monday" dayOfWeek="Monday"/><weeklyPattern description="tuesday" dayOfWeek="Tuesday"/><weeklyPattern description="wednesday" dayOfWeek="Wednesday"/><weeklyPattern description="thursday" dayOfWeek="Thursday"/><weeklyPattern description="friday" dayOfWeek="Friday"/><weeklyPattern description="saturday" dayOfWeek="Saturday"/><weeklyPattern dayOfWeek="Sunday" description="sunday"/><dailyPattern description="Test" startDate="2015-07-16" endDate="2015-08-13"/><dailyPattern description="Test_2" startDate="2015-07-22" endDate="2015-08-26"/><dailyPattern description="Tes21" startDate="2015-08-04" endDate="2015-08-11"/><unionPattern description="Tes21_1"><firstPattern>monday</firstPattern><furtherPatterns><furtherPattern>saturday</furtherPattern></furtherPatterns></unionPattern><weeklyPattern description="Teasa" dayOfWeek="Wednesday"/><cardinalYearlyPattern dayOfMonth="25" month="August" description="TesYear1"/><ordinalMonthlyPattern ordinal="first" dayType="day" description="TestMonthOrd"/><unionPattern description="TestLast"><firstPattern>monday</firstPattern><furtherPatterns><furtherPattern>tuesday</furtherPattern><furtherPattern>wednesday</furtherPattern><furtherPattern>thursday</furtherPattern><furtherPattern>friday</furtherPattern><furtherPattern>saturday</furtherPattern><furtherPattern>sunday</furtherPattern></furtherPatterns></unionPattern></patterns><users/><contacts><contact description="Anne BrÃ¼ggemann-Klein"/><contact description="David Becher"/></contacts><locations><location description="00.09.13A"/><location description="HS2"/></locations></calendarX>