<calendarX xmlns:xsi="http://www.w3.org/2001/XMLSchema-instance" xsi:noNamespaceSchemaLocation="CalendarX.xsd" description="Demonstrating super events"><calendars><calendar description="Demonstrating super events"><superEvents><superEvent description="XMLT2015" categories="teaching"><eventRules><eventRule description="XMLT2015" startTime="10:15:00" endTime="12:00:00" note=""><recurrencePattern>thursdaysInS105wOFeiertage</recurrencePattern><attendees/></eventRule></eventRules></superEvent><superEvent description="EPS2015" categories="teaching"><eventRules><eventRule description="EPS2015Mo" startTime="12:15:00" endTime="13:45:00" note=""><recurrencePattern>mondaysInS2015</recurrencePattern><attendees><attendee>Anne Brüggemann-Klein</attendee><attendee>David Becher</attendee></attendees><location>00.09.13A</location></eventRule><eventRule description="EPS2015Tue" startTime="16:15:00" endTime="17:45:00" note=""><recurrencePattern>tuesdaysInS2015</recurrencePattern><attendees><attendee>Anne Brüggemann-Klein</attendee></attendees><location>HS2</location></eventRule></eventRules></superEvent><superEvent description="Test"><eventRules><eventRule description="Test" startTime="10:00" endTime="12:00" note=""><attendees><attendee/></attendees><location><location>test</location></location></eventRule></eventRules></superEvent><superEvent description="Test"><eventRules><eventRule description="Test" startTime="10:00" endTime="12:00" note=""><attendees><attendee/></attendees><location><location>test</location></location></eventRule></eventRules></superEvent></superEvents></calendar><superEvent description="Test"><eventRules><eventRule description="Test" startTime="10:00" endTime="12:00" note=""><attendees><attendee/></attendees><location><location>test</location></location></eventRule></eventRules></superEvent></calendars><patterns><differencePattern description="thursdaysInS105wOFeiertage"><firstPattern>thursdaysInS2015</firstPattern><furtherPatterns><furtherPattern>Feiertage2015</furtherPattern></furtherPatterns></differencePattern><intersectionPattern description="thursdaysInS2015"><firstPattern>S2015</firstPattern><furtherPatterns><furtherPattern>thursdays</furtherPattern></furtherPatterns></intersectionPattern><unionPattern description="Feiertage2015"><firstPattern>ChrHf</firstPattern><furtherPatterns><furtherPattern>Fronleichnam</furtherPattern></furtherPatterns></unionPattern><dailyPattern description="ChrHf" startDate="2015-05-14" endDate="2015-05-14"/><dailyPattern description="Fronleichnam" startDate="2015-06-04" endDate="2015-06-04"/><dailyPattern description="S2015" startDate="2015-04-13" endDate="2015-07-17"/><weeklyPattern description="mondays" dayOfWeek="Monday"/><weeklyPattern description="tuesdays" dayOfWeek="Tuesday"/><weeklyPattern description="thursdays" dayOfWeek="Thursday"/><intersectionPattern description="mondaysInS2015"><firstPattern>S2015</firstPattern><furtherPatterns><furtherPattern>mondays</furtherPattern></furtherPatterns></intersectionPattern><intersectionPattern description="tuesdaysInS2015"><firstPattern>S2015</firstPattern><furtherPatterns><furtherPattern>tuesdays</furtherPattern></furtherPatterns></intersectionPattern></patterns><users/><contacts><contact description="Anne Brüggemann-Klein"/></contacts><locations><location description="00.09.13A"/><location description="HS2"/></locations></calendarX>